,PMID,database,title,abstract,nerve_transfer,double_innervation_type,free_flap,other_tissue,negative_outcome,positive_outcome,measuring_tool,tool_category,botox,doi,citation,authours,year,pmid,notes,patients,time_to_reinnervation_(min),time_to_reinnervation_(max),Age,min age,max age,follow up min,follow up max,old_notes,Notes_y,nerve_transfer_type_1,nerve_transfer_type_2,nerve_transfer_type_3,other_free_flap_type_1,free_flap_type_1,free_flap_type_2,free_flap_type_3
49,19952645,Pub-med,Outcomes of mini-hypoglossal nerve transfer and direct muscle neurotization for restoration of lower lip function in facial palsy,"Background: Most reconstructions for lower lip palsy focus on paralyzing the contralateral normal lip or providing static support on the affected side. The authors' unit has reported dynamic strategies for lower lip reanimation and use of 40 percent of the hypoglossal nerve (mini-hypoglossal) in facial reanimation. They report their experience with mini-hypoglossal nerve transfer for lower lip palsy. Methods: Between 1987 and 2005, 29 patients with unilateral facial palsy had lower lip reanimation with the mini-hypoglossal as the motor donor. Twenty patients had transfer of the mini-hypoglossal to the cervicofacial branch of the facial nerve and nine had direct depressor muscle neurotization. Five patients had a mean denervation time of 14.60 +/- 4.50 months (<2 years), and the rest had a mean denervation time of 10.63 +/- 9.23 years. In late cases, the facial nerve was in-continuity, and preoperative needle electromyographs of depressors showed at least fibrillations. Standardized videos taken preoperatively and at 2 years postoperatively were available for 27 patients and assessed by three independent reviewers. Needle electromyographic results were analyzed. Results: Thirteen patients (48.15 percent) achieved excellent and good results, nine (33.33 percent) had moderate results, and five (18.52 percent) obtained fair results. The difference between the averaged preoperative and postoperative scores was statistically significant, as was the difference in electromyographic outcomes (p < 0.0001, Wilcoxon signed rank test). The nerve transfer and direct neurotization groups had no statistically significant difference in clinical and electromyographic outcomes. Four patients required muscle transfer for further outcome upgrading. Conclusion: Use of the mini-hypoglossal either for nerve transfer or for direct muscle neurotization of lower lip depressors can provide reinnervation and satisfactory clinical function, even for muscles with prolonged partial denervation.",3,,0,1,0.0,2,6,3,0,10.1097/PRS.0b013e3181bf81f6,Plast Reconstr Surg. 2009 Dec;124(6):1891-1904. doi: 10.1097/PRS.0b013e3181bf81f6.,"Terzis JK, Tzafetta K.",2009,19952645,Tools: Clinical evaluation EMG Outcomes: comparisson of measurements preop vs postop,27.0,,,,,,,,,,Hypoglossal nerve transfer,,,,,,
50,20009835,Pub-med,Outcomes of direct muscle neurotization in pediatric patients with facial paralysis,"Background: Multistage reconstructive procedures are often required to try to restore the emotional potential of human expression in cases of facial paralysis. In this study, the senior author's (J.K.T.) experience with the technique of direct nerve to muscle neurotization as a part of multistage facial reanimation procedures is presented. Age, denervation time, etiology of the lesion, previous reconstructive procedures, and types of muscles responsible for animation were analyzed to make evidence-based recommendations on the indications of the technique as well as its role and effectiveness in facial reanimation. Methods: Retrospective review of 37 pediatric patients who underwent direct muscle neurotization took place. The patients were divided into three groups, depending on the region that direct neurotization was aiming to augment. Group A involved 28 patients for eye closure and blink, group B included 15 patients for smile, and group C included 19 patients for depressor augmentation. Results: Twenty patients were female and 17 male. Patient age ranged from 1 to 16 years, with a mean age (+/-SD) of 9 +/- 2.8 years. Denervation time ranged from 3 months to 15.25 years, and the mean denervation time was 6.72 years. Electromyographic scoring of the neurotized muscles showed an overall mean improvement of 36 percent for eye closure, 34.25 percent for blink, 37 percent for smile augmentation, and 30 percent for depressor function restoration. Conclusion: Direct muscle neurotization has a valid role in pediatric facial reanimation procedures, as it augments and promotes expressivity.",0,,0,0,0.0,7,6,2,0,10.1097/PRS.0b013e3181b98924,Plast Reconstr Surg. 2009 Nov;124(5):1486-1498. doi: 10.1097/PRS.0b013e3181b98924.,"Terzis JK, Karypidis D.",2009,20009835,"Tools: EMG Outcomes: Denervation time,",37.0,,,31.55,7.0,71.0,6.0,132.0,,,no nerve transfer,,,,,,
51,20048608,Pub-med,Direct tongue neurotization: the effect on speech intelligibility in patients with M‚Äö√†√∂‚Äö√†√ábius syndrome,"Background: M‚Äö√†√∂‚Äö√†√ábius syndrome is a disorder characterized by developmental impairment of cranial nerve VII, VI, often XII, and other cranial nerves. Facial reanimation in such patients restores the ability of some motion and of limited emotional expression. In one-fourth of these patients, hypoglossal involvement results in severe speech impairment due to tongue atrophy and lack of voluntary mobility. Bilabial incompetence due to facial paralysis further deteriorates speech capability. Direct tongue neurotization has been used by the senior author (J.K.T) to improve tongue function and speech intelligibility in patients with M‚Äö√†√∂‚Äö√†√ábius syndrome. This study presents the senior author's experience with the technique as a component of multistage facial reanimation procedures. Methods: Data collection was performed by retrospective review on six patients with M‚Äö√†√∂‚Äö√†√ábius syndrome who underwent direct tongue neurotization. In addition, each patient was videotaped for 30 minutes preoperatively and postoperatively according to a standardized protocol. Results: Four independent investigators scored speech intelligibility in each patient using a standardized grading system. The results showed considerable improvement in speech intelligibility and articulation. Higher improvement was noted in patients with partial bilateral hypoglossal involvement than in patients with complete unilateral involvement of the hypoglossal nerve, as well as in younger ages. No difference was noted between sexes. Conclusions: To the authors' knowledge, this is the first study presenting the effect of direct tongue neurotization on speech intelligibility in patients with M‚Äö√†√∂‚Äö√†√ábius syndrome. Tongue neurotization has therefore an important role in restoring the ability of these patients to communicate and obtain the potential to develop normal social skills.",3,,0,0,0.0,5,8,3,0,10.1097/PRS.0b013e3181c59d60,Plast Reconstr Surg. 2010 Jan;125(1):150-160. doi: 10.1097/PRS.0b013e3181c59d60.,"Terzis JK, Karypidis D.",2010,20048608,"scoring of speech intellgibility, EMG. Positive Outcomes: speech intelligibility",6.0,,,9.0,1.0,16.0,18.0,,,,Hypoglossal nerve transfer,,,,,,
52,20417006,Embase,Facial Animation With Free-Muscle Transfer Innervated by the Masseter Motor Nerve in Unilateral Facial Paralysis,"Purpose: Facial paralysis is a congenital or acquired disorder of varying severity leading to an asymmetric or absent facial expression. It represents an important debilitation from both esthetic and functional points of view. In this article we report our experience with patients treated with gracilis muscle transplantation innervated by the motor nerve to the masseter muscle. We discuss the surgical technique and the functional and esthetic results and evaluate the effectiveness of this donor nerve in providing adequate innervation to the muscle transfer for lower facial reanimation. Materials and Methods: Fifteen patients with unilateral facial paralysis were seen and surgically treated at the Department of Maxillofacial Surgery, University of Parma, Parma, Italy, between 2003 and 2007. In this study we report on 8 cases treated with gracilis muscle transfer reinnervated by the motor nerve to the masseter muscle. Results: In this series all free-muscle transplantations survived transfer, and no flap was lost. Facial symmetry at rest and while smiling was excellent or good in all patients, and we observed a significant improvement in speech and oral competence. With practice, the majority of patients developed the ability to smile spontaneously and without jaw movement. Conclusions: We consider the masseter motor nerve a powerful and reliable donor nerve, allowing us to obtain a commissure and upper lip movement similar to those of the normal site for amount and direction. This is why we think that there may be a larger role for the masseter motor nerve for innervation of patients with unilateral facial paralysis who would otherwise have been considered candidates for cross-facial nerve graft innervation of the muscle transfer. ¬© 2010 American Association of Oral and Maxillofacial Surgeons.",2,,1,3,0.0,9,4,1,0,10.1016/j.joms.2009.09.024,Journal of Oral and Maxillofacial Surgery (2010) 68:7 (1524-1529). Date of Publication: July 2010,"Bianchi B., Copelli C., Ferrari S., Ferri A., Bailleul C., Sesenna E.",2010,20417006,,15.0,3.5,,20.5,7.0,60.0,12.0,,,,Masseteric nerve transfer,,,,,,
53,20595861,Pub-med,Novel use of C7 spinal nerve for Moebius,"Background: The purpose of this study was to introduce the use of selective ipsilateral C7 spinal nerve transfer to the armamentarium of the dynamic procedures used for facial reanimation in Moebius patients. Methods: Between 1991 and 2007, the selective ipsilateral C7 technique was used in four patients. In three patients with bilateral paralysis, both C7 spinal nerves were utilized as nerve donors. Thus, evaluation of outcomes was carried out in seven hemifaces. Results: Short-term paresthesia on the index pulp of the donor upper extremity was observed in four limbs, which recovered spontaneously. Motor deficits were never noticed. Neurotization of the free-muscle transfer for smile was performed in five hemifaces, with good results in three hemifaces (p < 0.01, z = 2.61). Eye closure neurotization was made in six hemifaces, with good results in four hemifaces (p < 0.01, z = 2.88). Depressor neurotization was made in one case and resulted in improved depressor complex function. In two cases of free muscle transfer for masseter substitution, electromyographic interpretations revealed full motor activity after bilateral latissimus dorsi transfer. Tongue neurotization was performed in two instances. Postoperatively, the patients' speech intelligibility improved as well as tongue motility and bulk. Conclusion: The use of the C7 as a motor donor in Moebius cases with multicranial nerve involvement supplies the typical mask-like face with an abundance of motor fibers for facial reanimation and, if there is a coexisting twelfth nerve palsy, for speech restoration.",0,,2,1,9.0,9,8,3,0,10.1097/PRS.0b013e3181dbbd79,Plast Reconstr Surg. 2010 Jul;126(1):106-117. doi: 10.1097/PRS.0b013e3181dbbd79.,"Terzis JK, Konofaos P.",2010,20595861,,7.0,,,,,,,,Multiple nerve grafts:nerve transfer,,no nerve transfer,,,['Latissimus dorsi flap'],Latissimus dorsi flap,,
54,20595863,Pub-med,Blink restoration in adult facial paralysis,"Background: Impaired eyelid function in facial paralysis patients is a serious disability that can even threaten vision. Eye reanimation techniques and specifically blink restoration reinstates the cornea's protective mechanism and recovers a more natural appearance and eye function. Both dynamic and static procedures have been used to augment eye closure, but only dynamic procedures can lead to blink restoration. In this study, the experience of a single surgeon (J.K.T.) with dynamic procedures addressing the challenge of blink restoration is presented. Methods: A retrospective review of 95 adult patients who underwent dynamic procedures for blink restoration was performed. The patients were divided into two groups. Group A (n = 75) included patients who underwent nerve transfers, including cross-facial nerve grafting and subsequent microcoaptations, mini-hypoglossal nerve transfers, and direct orbicularis oculi muscle neurotization. Group B (n = 20) included patients who underwent eye sphincter substitution procedures, including pedicled frontalis or mini-temporalis transfers, free platysma, occipitalis, gracilis subunits, extensor digitorum brevis, and a slip of adductor longus transfer. Objective blink ratios were measured according to a protocol established by the senior author (J.K.T.). Results: The patients included 34 men and 61 women. Mean age was 34.9 +/- 9.8 years. Denervation time ranged from 7 months to 42.12 years, and the mean denervation time was 13.02 years. Blink improvement was noted in all of the patients. Blink scores and ratios were consistently better in group A than in group B. Conclusion: Dynamic procedures provide the functional substrate on which subsequent static procedures can be performed and aid blink return.",4,,1,1,0.0,5,2,1,0,10.1097/PRS.0b013e3181dbbf34,Plast Reconstr Surg. 2010 Jul;126(1):126-139. doi: 10.1097/PRS.0b013e3181dbbf34.,"Terzis JK, Karypidis D.",2010,20595863,Tools: Terzis and Bruno methodology Outcomes: Blink scores,75.0,1.0,5.0,12.5,3.0,43.0,26.0,97.0,"Multiple nerve grafts:cross-facial,hypoglossal",,Cross-facial nerve transfer,Hypoglossal nerve transfer,,,,,
55,20643594,Embase,Outcomes of direct muscle neurotisation in adult facial paralysis,"Fifty-seven adult patients with facial paralysis, who underwent direct muscle neurotisation, were reviewed and divided into three categories depending on the function that direct neurotisation was aiming to augment. Group 1 included 30 patients who underwent direct neurotisation for eye closure and blink, group 2 consisted of 23 patients for smile augmentation, and group 3 comprised 31 patients for depressor. The age of the patients ranged from 21 to 74 years. Denervation time (Dt) ranged from 8 months to 42 years. Eight patients had partial facial paralysis, and 49 patients had complete facial paralysis. The results were based on the functional and electromyography (EMG) scoring of the neurotised muscles showing an overall EMG mean improvement of 26.56% in eye closure, 34.47% in smile restoration and 32.67% in depressor function by the procedure. Median improvement in all facial functions was one grade (25%) in theTerzis grading systems regarding the respective facial functions. The prerequisites are Dt less than 6 months and a functional contralateral facial nerve. In cases where Dt is more than 27 months and preoperative EMG's are silent, a free or pedicled muscle should be used to substitute the denervated native facial muscle. Promoting expressivity and augmenting facial muscle function using direct muscle neurotisation are important components in facial reanimation. ¬© 2010 British Association of Plastic, Reconstructive and Aesthetic Surgeons. Published by Elsevier Ltd. All rights reserved.",0,,0,0,0.0,9,8,3,0,10.1016/j.bjps.2010.04.045,"Journal of Plastic, Reconstructive and Aesthetic Surgery (2011) 64:2 (174-184). Date of Publication: February 2011","Terzis J.K., Karypidis D.",2011,20643594,"clinical eval and EMG
pos: eye closure, depressor restoration, smile restoration",57.0,,,34.9,,,,,,,no nerve transfer,,,,,,
56,20655175,Pub-med,Facial animation in patients with Moebius and Moebius-like syndromes,"Moebius syndrome, a rare congenital disorder of varying severity, involves multiple cranial nerves and is characterised predominantly by bilateral or unilateral paralysis of the facial and abducens nerves. Facial paralysis causes inability to smile and bilabial incompetence with speech difficulties, oral incompetence, problems with eating and drinking, including pocketing of food in the cheek and dribbling, as well as severe drooling. Other relevant clinical findings are incomplete eye closure and convergent strabismus. The authors report on 48 patients with Moebius and Moebius-like syndromes seen from 2003 to September 2007 (23 males and 25 females, mean age 13.9 years). In 20 cases a reinnervated gracilis transplant was performed to re-animate the impaired sides of the face. In this series, all free-muscle transplantations survived the transfer, and no flap was lost. In 19 patients complete reinnervation of the muscle was observed with an excellent or good facial symmetry at rest in all patients and whilst smiling in 87% of cases. In conclusion, according to the literature, the gracilis muscle free transfer can be considered a safe and reliable technique for facial reanimation with good aesthetic and functional results.",0,,0,0,9.0,9,8,1,0,10.1016/j.ijom.2010.06.020,Int J Oral Maxillofac Surg. 2010 Nov;39(11):1066-73. doi: 10.1016/j.ijom.2010.06.020. Epub 2010 Jul 22.,"Bianchi B, Copelli C, Ferrari S, Ferri A, Sesenna E.",2010,20655175,"Tools: O'Brien criteria, clinical evaluation Outcomes: symmetry, complications(seroma,hypertrophic scars,dyskenesias), smile, commissure movement,",48.0,,,42.0,21.0,74.0,18.0,,,,no nerve transfer,,,,,,
57,21093962,Pub-med,Split hypoglossal-facial nerve neurorrhaphy for treatment of the paralyzed face,"Background: Several methods of neural rehabilitation for facial paralysis using 12-7 transfers have been described. The purpose of this study is to report on a series for dynamic reinnervation of the paralyzed face by using a split 12-7 nerve transposition. The goals of this procedure are to minimize tongue morbidity and to provide good facial reinnervation. Methods: Prospective case series. Melolabial crease discursion, overall facial movement, and degree of tongue atrophy and mobility were recorded. Results: Thirteen patients underwent facial reanimation using a split hypoglossal-facial nerve transfer with postoperative follow-up to 58 months (range, 6-58 months). All patients achieved excellent rest symmetry and facial tone. Of 13 patients, 10 had measurable coordinated movement and discursion of their melolabial crease. Of 13 patients, 12 had mild to moderate ipsilateral tongue atrophy. The mean time to onset of visible reinnervation was 3 months. Conclusion: Split hypoglossal-facial nerve transposition provides good rehabilitation of facial nerve paralysis with reduced lingual morbidity. Long-term rest symmetry and potential learned movement can be achieved. This technique may provide a favorable alternative to the traditional method of complete hypoglossal sacrifice or jump grafting.",3,,0,0,0.0,9,8,1,0,10.1016/j.amjoto.2010.09.007,Am J Otolaryngol. 2011 Nov-Dec;32(6):511-6. doi: 10.1016/j.amjoto.2010.09.007. Epub 2010 Nov 20.,"Shipchandler TZ, Seth R, Alam DS.",2011,21093962,"Tools: HB scores, May's classification, clinical examination Outcomes: symmetry, facial tone, facial movement, discursion of melolabial crease, tongue atrophy, reinnervation",13.0,3.0,5.0,13.9,1.0,48.0,12.0,,,,Hypoglossal nerve transfer,,,,,,
58,21145243,Embase,Deep-planes lift associated with free flap surgery for facial reanimation,"Between April 1999 and April 2008, 37 patients with long-standing facial paralysis underwent a one-stage facial reanimation with neuromuscular free flaps: 28 patients (group A) underwent flap transposition only; 9 patients (group B) underwent a deep-planes lift (DPL) composed of the superficial muscoloaponeurotic system + parotid fascia at the time of facial reanimation. The postoperative and final results were compared between groups A and B, following the classification of Terzis and Noah (1997). Before the onset of contraction, only group B patients (100%) showed good or moderate symmetry at rest, while none of the patients of group A had a symmetric face. The respective final results for patients in groups A and B who already showed the onset of flap contraction were excellent in 28.6% and 44.5%, good in 42.9% and 33.3%, moderate in 10.7% and 22.2%, and fair or poor and fair in 17.8% and 0% of patients, respectively. The DPL allows immediate symmetry of the face at rest and contributes to upgrading the final static and dynamic results in facial reanimation with free muscular flaps. ¬© 2010 European Association for Cranio-Maxillo-Facial Surgery.",0,,2,0,9.0,9,2,1,0,10.1016/j.jcms.2010.09.003,Journal of Cranio-Maxillofacial Surgery (2011) 39:7 (475-481). Date of Publication: October 2011,"Biglioli F., Frigerio A., Autelitano L., Colletti G., Rabbiosi D., Brusati R.",2011,21145243,"neg: pseudospasm, repositioning of muscle required
tool: Terzis and Noah grading scale",37.0,3.0,,,,,6.0,,,,no nerve transfer,,,['Fascia flap'],Fascia lata,,
59,21242425,Pub-med,Minimally invasive temporalis tendon transposition,"Objective: To describe a minimally invasive approach of the temporalis tendon transposition technique for dynamic reanimation in patients with long-standing facial paralysis. Methods: We report a case series of 17 consecutive patients with facial paralysis who underwent minimally invasive temporalis tendon transposition surgery for dynamic facial reanimation between January 1, 2006, and December 31, 2008. The minimally invasive technique is described. Preoperative and postoperative records, photographs, and videos were reviewed for feasibility of the technique, symmetry, oral competence, and dynamic oral commissure movement. Results: All the patients tolerated the procedure well, and none developed procedure-related complications. All the patients achieved improved symmetry at rest and voluntary motion of the oral commissure. In all the patients, the temporalis tendon was transposed to the modiolus without the need for fascial extension or lengthening myoplasty. Conclusions: The temporalis tendon can be transposed for immediate dynamic reanimation of the paralyzed lower face using a minimally invasive approach. This procedure involves a single small incision and minimal dissection, with no major osteotomies. Acquisition of desired facial movement requires intensive physiotherapy and a motivated patient.",0,,0,1,0.0,9,4,1,0,10.1001/archfacial.2010.100,Arch Facial Plast Surg. 2011 Jan-Feb;13(1):8-13. doi: 10.1001/archfacial.2010.100.,"Boahene KD, Farrag TY, Ishii L, Byrne PJ.",2011,21242425,Sokolovsky scale,17.0,,,,,,,,,,no nerve transfer,,,,,,
60,21558933,Embase,Smile reconstruction through bilateral muscular transplants neurotized by hypoglossal nerves,"Free transplant of gracilis muscle is the criterion-standard technique in dynamic rehabilitation of long-standing facial paralysis in which the facial musculature is atrophied. When the facial nerve is not available because of a bilateral lesion, other sources are the masseteric, hypoglossal, or accessory nerves. Although the use of hypoglossal nerve has been relegated to the background because of the morbidity caused by its loss, there are special situations in which the hypoglossal nerve should be considered the first option as donor motor nerve. The present article discusses the case of a patient with dynamic reanimation of bilateral facial paralysis with free-muscle transfer neurotized to the hypoglossal nerve. End-to-side coaptation of gracilis motor nerve and hypoglossal motor nerve allows neurotization of the transplanted muscle with minimum repercussion in speech or swallowing and can provide an adequate spontaneous smile with time. Copyright ¬© 2011 by Mutaz B. Habal, MD.",3,,1,1,0.0,2,4,1,0,10.1097/SCS.0b013e31820f7d50,Journal of Craniofacial Surgery (2011) 22:3 (845-857). Date of Publication: May 2011,"Hontanilla B., Aub√° C.",2011,21558933,,1.0,,,,,,,,,,Hypoglossal nerve transfer,,,,,,
61,21576665,Pub-med,Free gracilis transfer for smile in children: the Massachusetts Eye and Ear Infirmary Experience in excursion and quality-of-life changes,"Background: Free muscle transfer for facial reanimation has become the standard of care in recent decades and is now the cornerstone intervention for dynamic smile reanimation. We sought to quantify smile excursion and quality-of-life (QOL) changes in our pediatric free gracilis recipients following reanimation. Methods: We quantified gracilis muscle excursion in 17 pediatric patients undergoing 19 consecutive pediatric free gracilis transplantation operations, using our validated SMILE program, as an objective measure of functional outcome. These were compared against excursion measured the same way in a cohort of 17 adults with 19 free gracilis operations. In addition, we prospectively evaluated QOL outcomes in these children using the Facial Clinimetric Evaluation (FaCE) instrument. Results: The mean gracilis excursion in our pediatric free gracilis recipients was 8.8 mm ¬¨¬®¬¨¬± 5.0 mm, which matched adult results, but with fewer complete failures of less than 2-mm excursion, with 2 (11%) and 4 (21%), respectively. Quality-of-life measures indicated statistically significant improvements following dynamic smile reanimation (P = .01). Conclusions: Dynamic facial reanimation using free gracilis transfer in children has an acceptable success rate, yields improved commissure excursion, and improves QOL in the pediatric population. It should be considered first-line therapy for children with lack of a meaningful smile secondary to facial paralysis.",0,,1,0,5.0,9,8,3,0,10.1001/archfacial.2011.29,Arch Facial Plast Surg. 2011 May-Jun;13(3):190-4. doi: 10.1001/archfacial.2011.29.,"Hadlock TA, Malo JS, Cheney ML, Henstrom DK.",2011,21576665,,17.0,,,,,,,,,,no nerve transfer,,,,,,
