,PMID,database,title,abstract,nerve_transfer,double_innervation_type,free_flap,other_tissue,negative_outcome,positive_outcome,measuring_tool,tool_category,botox,doi,citation,authours,year,pmid,notes,patients,time_to_reinnervation_(min),time_to_reinnervation_(max),Age,min age,max age,follow up min,follow up max,old_notes,Notes_y,nerve_transfer_type_1,nerve_transfer_type_2,nerve_transfer_type_3,other_free_flap_type_1,free_flap_type_1,free_flap_type_2,free_flap_type_3
96,25626821,Pub-med,The degree of facial movement following microvascular muscle transfer in pediatric facial reanimation depends on donor motor nerve axonal density,"Background: Free functional muscle transfer to the face is a standard of facial animation. The contralateral facial nerve, via a cross-face nerve graft, provides spontaneous innervation for the transferred muscle, but is not universally available and has additional shortcomings. The motor nerve to the masseter provides an alternative innervation source. In this study, the authors compared donor nerve histomorphometry and clinical outcomes in a single patient population undergoing free muscle transfer to the face. Methods: Pediatric patients undergoing dynamic facial (re-)animation with intraoperative nerve biopsies and gracilis transfer to the face powered by either the contralateral facial nerve via a cross-face nerve graft or the motor nerve to the masseter were reviewed over a 7-year period. Myelinated nerve counts were assessed histomorphometrically, and functional outcomes were evaluated with the Scaled Measurement of Improvement in Lip Excursion software. Results: From 2004 to 2011, 91 facial (re-)animation procedures satisfied study inclusion criteria. Average myelinated fiber counts were 6757 per mm2 in the donor facial nerve branch, 1647 per mm in the downstream cross-face nerve graft at the second stage, and 5289 per mm in the masseteric nerve. Reconstructions with either innervation source resulted in improvements in oral commissure excursion and smile symmetry, with the greatest amounts of oral commissure excursion noted in the masseteric nerve group. Conclusions: Facial (re-)animation procedures with use of the cross-face nerve graft or masseteric nerve are effective and result in symmetric smiles. The masseteric nerve provides a more robust innervation source and results in greater commissure excursion. Clinical question/level of evidence: Therapeutic, III.",4,,1,3,0.0,9,8,3,0,10.1097/PRS.0000000000000860,Plast Reconstr Surg. 2015 Feb;135(2):370e-381e. doi: 10.1097/PRS.0000000000000860.,"Snyder-Warwick AK, Fattah AY, Zive L, Halliday W, Borschel GH, Zuker RM.",2015,25626821,"histomorphometry, axon counts, Scaled Measurements of Improveemnt in Lip Excursion measurements",91.0,,,,,,,,"Multiple nerve grafts:cross-face,masseteric nerve",,Cross-facial nerve transfer,Masseteric nerve transfer,,,,,
97,25824195,Pub-med,Masseteric nerve transfer for short-term facial paralysis following skull base surgery,"Background: Nerve transfers have been widely used to reanimate paralyzed facial muscles after irreversible proximal injuries to the facial nerve. The author has developed a technique involving masseteric nerve transfer combined with cross-facial nerve grafting for treating skull base surgery-induced facial paralysis. This paper aims to demonstrate that this procedure is effective and causes negligible donor site morbidity. Methods: Seven patients who developed facial paralysis after the removal of skull base tumors were treated with masseteric nerve transfer combined with cross-facial nerve grafting with the aim of reanimating the miDFace. The mean period of preoperative paralysis was 6 months. The follow-up period ranged from 22 to 65 months (mean: 46 months). The patients were evaluated with physical examinations and video analysis. Results: Successful reanimation of the miDFace was achieved in all patients except one, whose muscle tone recovered. On average, facial motion developed 4 months after the nerve transfer. Only minimal coordinated eyelid movement was seen during biting. None of the patients experienced impaired masticatory function or visible wasting of the masseter muscle. All of the patients who recovered the ability to contract their paralyzed muscles were able to close their eyes tightly during biting; however, none of the patients have been able to achieve an effortless spontaneous smile. Conclusions: Masseteric nerve transfer is an alternative method for selective reanimation of the miDFace and does not cause donor site morbidity.",4,,0,0,10.0,9,8,3,0,10.1016/j.bjps.2015.02.031,J Plast Reconstr Aesthet Surg. 2015 Jun;68(6):764-70. doi: 10.1016/j.bjps.2015.02.031. Epub 2015 Mar 19.,"Yoshioka N, Tominaga S.",2015,25824195,neg: no effortless spontaneous smile,7.0,,,,,,,,"Multiple nerve grafts:cross-facial,masseteric nerve",,Cross-facial nerve transfer,Masseteric nerve transfer,,,,,
98,25868011,Pub-med,Single-stage dynamic reanimation of the smile in irreversible facial paralysis by free functional muscle transfer,"Unilateral facial paralysis is a common disease that is associated with significant functional, aesthetic and psychological issues. Though idiopathic facial paralysis (Bell's palsy) is the most common diagnosis, patients can also present with a history of physical trauma, infectious disease, tumor, or iatrogenic facial paralysis. Early repair within one year of injury can be achieved by direct nerve repair, cross-face nerve grafting or regional nerve transfer. It is due to muscle atrophy that in long lasting facial paralysis complex reconstructive methods have to be applied. Instead of one single procedure, different surgical approaches have to be considered to alleviate the various components of the paralysis. The reconstruction of a spontaneous dynamic smile with a symmetric resting tone is a crucial factor to overcome the functional deficits and the social handicap that are associated with facial paralysis. Although numerous surgical techniques have been described, a two-stage approach with an initial cross-facial nerve grafting followed by a free functional muscle transfer is most frequently applied. In selected patients however, a single-stage reconstruction using the motor nerve to the masseter as donor nerve is superior to a two-stage repair. The gracilis muscle is most commonly used for reconstruction, as it presents with a constant anatomy, a simple dissection and minimal donor site morbidity. Here we demonstrate the pre-operative work-up, the post-operative management, and precisely describe the surgical procedure of single-stage microsurgical reconstruction of the smile by free functional gracilis muscle transfer in a step by step protocol. We further illustrate common pitfalls and provide useful tips which should enable the reader to truly comprehend the procedure. We further discuss indications and limitations of the technique and demonstrate representative results.",1,,1,0,0.0,2,8,3,0,10.3791/52386,J Vis Exp. 2015 Mar 1;(97):52386. doi: 10.3791/52386.,"Thiele J, Bannasch H, Stark GB, Eisenhardt SU.",2015,25868011,,5.0,,,,,,,,,,Cross-facial nerve transfer,,,,,,
99,25878931,Pub-med,Postparalysis facial synkinesis: clinical classification and surgical strategies,"Background: Postparalysis facial synkinesis (PPFS) can occur after any cause of facial palsy. Current treatments are still inadequate. Surgical intervention, instead of Botox and rehabilitation only, for different degrees of PPFS was proposed. Methods: Seventy patients (43 females and 27 males) with PPFS were enrolled since 1986. They were divided into 4 patterns based on quality of smile and severity of synkinesis. Data collection for clinically various presentations was made: pattern I (n = 14) with good smile but synkinesis, pattern II (n = 17) with acceptable smile but dominant synkinesis, pattern III (n = 34) unacceptable smile and dominant synkinesis, and pattern IV (n = 5) poor smile and synkinesis. Surgical interventions were based on patterns of PPFS. Selective myectomy and some cosmetic procedures were performed for pattern I and II patients. Extensive myectomy and neurectomy of the involved muscles and nerves followed by functioning free-muscle transplantation for facial reanimation in 1- or 2-stage procedure were performed for pattern III and many pattern II patients. A classic 2-stage procedure for facial reanimation was performed for pattern IV patients. Results: Minor aesthetic procedures provided some help to pattern I patients but did not cure the problem. They all had short follow-up. Most patients in patterns II (14/17, 82%) and III (34/34, 100%) showed a significant improvement of eye and smile appearance and significant decrease in synkinetic movements following the aggressively major surgical intervention. Nearly, all of the patients treated by the authors did not need repeated botulinum toxin A injection nor require a profound rehabilitation program in the follow-up period. Conclusions: Treatment of PPFS remains a challenging problem. Major surgical reconstruction showed more promising and long-lasting results than botulinum toxin A and/or rehabilitation on pattern III and II patients.",0,,1,0,1.0,9,2,3,1,10.1097/GOX.0000000000000283,Plast Reconstr Surg Glob Open. 2015 Apr 7;3(3):e320. doi: 10.1097/GOX.0000000000000283. eCollection 2015 Mar.,"Chuang DC, Chang TN, Lu JC.",2015,25878931,"Tools: Smiling Score, Cortical Adaptation Stage System, Synkinesis Gradeing System, Satisfactory Score Outcomes: eye and smile appearance, sykinetic movements multiple types of free flaps",70.0,,,,,,,,,,no nerve transfer,,,,,,
100,25915681,Pub-med,How to rehabilitate long-term facial paralysis,"Objective: To project the surgical resuscitation methods that we apply to the lower part of the face and the eyes with the aim of preventing functional and psychological problems that can occur in patients with facial paralysis. Materials and methods: Twenty-two patients with facial nerve paralysis due to acoustic neuroma, trauma, cholesteatoma, and parotid carcinoma were included in this study. In the lower facial region, the temporal muscle was suspended to the lower lip. In the upper facial region, eyelid gold implantation was performed. The reanimation results of the upper and lower facial regions were graded as excellent, good, fair, and poor in consideration of the symmetry after rest and smile according to May classification in the third month after the surgery. Results: The study group comprised 15 men (68.2%) and 5 women (31.8 %) (mean age, 63.82 ¬¨¬®¬¨¬Æ¬¨¬®¬¨¬± 14.18 years; range, 8-78 years). Of the patients, 18.2% (n = 4) had acoustic neuroma, 40.9% (n = 9) had facial trauma, 27.3% (n = 6) had cholesteatoma, and 13.6% (n = 3) had parotid carcinoma.Reanimation techniques were applied to 40.9% (n = 9) of the patients during the first 2-4 years, whereas 59.1% (n = 13) of patients underwent surgery after 4 years.In a total of 17 patients (77.3%) who had lower lip intervention, 4 patients (23.5%) had excellent results, 7 patients (41.2%) had good results, and 6 patients (35.3%) had moderate results.In the 22 patients who underwent the eyelid procedure, 5 patients (22.7 %) had excellent results, 13 patients (59.1 %) had good results, and 3 patients (18.2 %) had moderate results. Poor results were not observed in any patient. Conclusion: Facial paralysis is a disease that causes serious functional and psychological problems in patients. Therefore, the choice of treatment method is dependent on the etiology, duration of paralysis, expectations of the patient, and experience of the surgeon. Being less invasive methods, obtaining immediate results, requiring single surgical stage, and having long-lasting results and dynamic muscle transfer and static suspension methods are preferred.",0,,0,3,10.0,9,2,1,0,10.1097/SCS.0000000000001571,J Craniofac Surg. 2015 May;26(3):831-5. doi: 10.1097/SCS.0000000000001571.,"Kumral TL, Uyar Y, Berkiten G, Mutlu AT, Ata‚Äö√Ñ√∂‚àö‚Ä†‚àö‚àÇ‚Äö√†√∂‚àö¬∫ E, S‚Äö√Ñ√∂‚àö‚Ä†‚àö‚àÇ¬¨¬®‚Äö√†¬¥nnet‚Äö√Ñ√∂‚àö‚Ä†‚àö‚àÇ‚Äö√†√∂‚àö¬∫i G, Yildirim G.",2015,25915681,"Tools: May's classification ""eyelid gold"" implantation also performed Negative Outcomes: inflammation Positive Outcomes: symmetry, complete eye-closure",17.0,,,,,,,,,,no nerve transfer,,,,,,
101,26026222,Pub-med,Double-powered free gracilis muscle transfer for smile reanimation: A longitudinal optoelectronic study,"The choice of the motor donor nerve is a crucial point in free flap transfer algorithms. In the case of unilateral facial paralysis, the contralateral healthy facial nerve can provide coordinated smile animation and spontaneous emotional expression, but with unpredictable axonal ingrowth into the recipient muscle. Otherwise, the masseteric nerve ipsilateral to the paralysis can provide a powerful neural input, without a spontaneous trigger of the smile. Harvesting a bulky muscular free flap may enhance the quantity of contraction but esthetic results are unpleasant. Therefore, the logical solution for obtaining high amplitude of smiling combined with spontaneity of movement is to couple the neural input: the contralateral facial nerve plus the ipsilateral masseteric nerve. Thirteen patients with unilateral dense facial paralysis underwent a one-stage facial reanimation with a gracilis flap powered by a double donor neural input, provided by both the ipsilateral masseteric nerve (coaptation by an end-to-end neurorrhaphy with the obturator nerve) and the contralateral facial nerve (coaptation through a cross-face nerve graft: end-to-end neurorrhaphy on the healthy side and end-to-side neurorrhaphy on the obturator nerve, distal to the masseteric/obturator neurorrhaphy). Their facial movements were evaluated with an optoelectronic motion analyzer. Before surgery, on average, the paretic side exhibited a smaller total three-dimensional mobility than the healthy side, with a 52% activation ratio and >30% of asymmetry. After surgery, the differences significantly decreased (analysis of variance (ANOVA), p < 0.05), with an activation ratio between 75% (maximum smile) and 91% (maximum smile with teeth clenching), and <20% of asymmetry. Similar modifications were seen for the performance of spontaneous smiles. The significant presurgical asymmetry of labial movements reduced after surgery. The use of a double donor neural input permitted both movements that were similar in force to that of the healthy side, and spontaneous movements elicited by emotional triggering.",6,Masseteric + CFNG,1,0,3.0,2,8,3,0,10.1016/j.bjps.2015.03.029,J Plast Reconstr Aesthet Surg. 2015 Jul;68(7):930-9. doi: 10.1016/j.bjps.2015.03.029. Epub 2015 Apr 21.,"Sforza C, Frigerio A, Mapelli A, Tarabbia F, Annoni I, Colombo V, Latiff M, Pimenta Ferreira CL, Rabbiosi D, Sidequersky FV, Zago M, Biglioli F.",2015,26026222,tools: clinical and optoelectronic motion analyzer.,13.0,10.0,,,,,,,"Multiple nerve grafts:cross-face,masseteric nerve",,Double innervation,,,,,,
102,26061795,Embase,Reconstruction of facial nerve after radical parotidectomy,"Conclusion: Most patients benefitted from immediate facial nerve grafting after radical parotidectomy. Even weak movement is valuable and can be augmented with secondary static operations. Post-operative radiotherapy does not seem to affect the final outcome of facial function. Objectives: During radical parotidectomy, the sacrifice of the facial nerve results in severe disfigurement of the face. Data on the principles and outcome of facial nerve reconstruction and reanimation after radical parotidectomy are limited and no consensus exists on the best practice. Method: This study retrospectively reviewed all patients having undergone radical parotidectomy and immediate facial nerve reconstruction with a free, non-vascularized nerve graft at the Helsinki University Hospital, Helsinki, Finland during the years 1990-2010. There were 31 patients (18 male; mean age = 54.7 years; range = 30-82) and 23 of them had a sufficient follow-up time. Results: Facial nerve function recovery was seen in 18 (78%) of the 23 patients with a minimum of 2-year follow-up and adequate reporting available. Only slight facial movement was observed in five (22%), moderate or good movement in nine (39%), and excellent movement in four (17%) patients. Twenty-two (74%) patients received post-operative radiotherapy and 16 (70%) of them had some recovery of facial nerve function. Nineteen (61%) patients needed secondary static reanimation of the face.",5,,0,0,9.0,9,4,1,0,10.3109/00016489.2015.1050604,Acta Oto-Laryngologica (2015) 135:10 (1065-1069). Date of Publication: 3 Oct 2015,"Renkonen S., Sayed F., Keski-S√§ntti H., Yl√§-Kotola T., B√§ck L., Suominen S., Kanerva M., M√§kitie A.A.",2015,26061795,,23.0,,,,,,,,"Multiple nerve grafts:nerve graft,nerve grafting",,Undefined facial nerve transfer,,,,,,
103,26143295,Pub-med,Masseteric-facial nerve transposition for reanimation of the smile in incomplete facial paralysis,"Incomplete f+C636acial paralysis occurs in about a third of patients with Bell's palsy. Although their faces are symmetrical at rest, when they smile they have varying degrees of disfigurement. Currently, cross-face nerve grafting is one of the most useful techniques for reanimation. Transfer of the masseteric nerve, although widely used for complete paralysis, has not to our knowledge been reported for incomplete palsy. Between December 2008 and November 2013, we reanimated the faces of 9 patients (2 men and 7 women) with incomplete unilateral facial paralysis with transposition of the masseteric nerve. Sex, age at operation, cause of paralysis, duration of denervation, recipient nerves used, and duration of follow-up were recorded. Commissural excursion, velocity, and patients' satisfaction were evaluated with the FACIAL CLIMA and a questionnaire, respectively. The mean (SD) age at operation was 39 (¬¨¬®¬¨¬Æ¬¨¬®¬¨¬±6) years and the duration of denervation was 29 (¬¨¬®¬¨¬Æ¬¨¬®¬¨¬±19) months. There were no complications that required further intervention. Duration of follow-up ranged from 6-26 months. FACIAL CLIMA showed improvement in both commissural excursion and velocity of more than two thirds in 6 patients, more than one half in 2 patients and less than one half in one. Qualitative evaluation showed a slight or pronounced improvement in 7/9 patients. The masseteric nerve is a reliable alternative for reanimation of the smile in patients with incomplete facial paralysis. Its main advantages include its consistent anatomy, a one-stage operation, and low morbidity at the donor site.",2,,0,0,4.0,9,8,3,0,10.1016/j.bjoms.2015.06.011,Br J Oral Maxillofac Surg. 2015 Dec;53(10):943-8. doi: 10.1016/j.bjoms.2015.06.011. Epub 2015 Jul 2.,"Hontanilla B, Marre D.",2015,26143295,,9.0,,,,,,,,"Multiple nerve grafts:cross-face,masseteric nerve",,Masseteric nerve transfer,,,,,,
104,26316293,Pub-med,Facial reanimation using hypoglossal-facial neurorrhaphy with end-to-side coaptation between the jump interpositional nerve graft and hypoglossal nerve: Outcome and duration of preoperative paralysis,"Background: In this report, we described the use of hypoglossal-facial neurorrhaphy with end-to-side coaptation between the jump interpositional nerve graft and the hypoglossal nerve for facial reanimation and analyzed the relationship between the outcome of surgery and duration of preoperative paralysis. Methods: We performed hypoglossal-facial neurorrhaphy with the jump interpositional nerve graft on nine men and 10 women with unilateral complete facial paralysis. The patients, with a mean age of 39.7 ¬¨¬®¬¨¬Æ¬¨¬®¬¨¬± 18.1 years (range, 8-65 years) at the time of surgery, experienced preoperative paralysis ranging from 1 to 150 months (mean, 16.9 ¬¨¬®¬¨¬Æ¬¨¬®¬¨¬± 34.9 months). The movement of the corners of the mouth was evaluated 12 months after surgery using a unique method based on the House-Brackmann grading scale. Results: The mean follow-up was 5.6 ¬¨¬®¬¨¬Æ¬¨¬®¬¨¬± 1.6 years (range, 3-9 years). The movement of the corners of mouth was classified as excellent in two cases, good in seven cases, fair in two cases, and poor in eight cases. Nine of the 11 cases with preoperative paralysis of 6 months or less had excellent or good results, whereas none of the eight cases with preoperative paralysis of 7 months or longer yielded excellent or good results, showing a significant difference (P = 0.01). Conclusions: To achieve successful reanimation of the corners of the mouth, hypoglossal-facial neurorrhaphy with end-to-side coaptation between the jump interpositional nerve graft and the hypoglossal nerve should be performed within 6 months after the onset of facial nerve paralysis. ¬¨¬®¬¨¬Æ¬¨¬®¬¨¬© 2015 Wiley Periodicals, Inc. Microsurgery 36:460-466, 2016.",3,,0,0,0.0,7,2,1,0,10.1002/micr.22393,Microsurgery. 2016 Sep;36(6):460-6. doi: 10.1002/micr.22393. Epub 2015 Aug 28.,"Okochi M, Ueda K, Okochi H, Asai E, Sakaba T, Kajikawa A.",2016,26316293,modified HB scale Outcomes: tongue atrophy,11.0,,,,,,,,,,Hypoglossal nerve transfer,,,,,,
105,26595022,Pub-med,Epidemiologic Overview of Synkinesis in 353 Patients with Longstanding Facial Paralysis under Treatment with Botulinum Toxin for 11 Years,"Background: Patients with longstanding facial paralysis often exhibit synkinesis. Few reports describe the prevalence and factors related to the development of synkinesis after facial paralysis. Botulinum toxin type A injection is an important adjunct treatment for facial paralysis-induced asymmetry and synkinesis. The authors assessed the clinical and epidemiologic characteristics of patients with sequelae of facial paralysis treated with botulinum toxin type A injections to evaluate the prevalence of synkinesis and related factors. Methods: A total of 353 patients (age, 4 to 84 years; 245 female patients) with longstanding facial paralysis underwent 2312 botulinum toxin type A injections during an 11-year follow-up. Doses used over the years, previous treatments (electrical stimulation, operations), and how they correlated to postparalysis and postreanimation synkinesis were analyzed. Results: There was a significant association between cause and surgery. Most patients with facial paralysis caused by a congenital defect, trauma, or a tumor underwent reanimation. There were no sex- or synkinesis-related differences in the doses used, but the doses were higher in the reanimation group than in the no-surgery group. Synkinesis was found in 196 patients; 148 (41.9 percent) presented with postparalysis synkinesis (oro-ocular, oculo-oral) and 58 (16.4 percent) presented with postreanimation synkinesis. Ten patients presented with both types. Conclusions: This study determined the high prevalence (55.5 percent) of synkinesis in patients with longstanding facial paralysis. Postparalysis synkinesis was positively associated with infectious and idiopathic causes, electrical stimulation, facial nerve decompression, and no requirement for surgery. Postreanimation synkinesis was present in 28.2 percent of reanimated patients and was significantly associated with microsurgical flaps, transfacial nerve grafting, masseteric-facial anastomosis, and temporalis muscle transfers.",4,,0,1,1.0,0,4,1,1,10.1097/PRS.0000000000001802,Plast Reconstr Surg. 2015 Dec;136(6):1289-1298. doi: 10.1097/PRS.0000000000001802.,"Salles AG, da Costa EF, Ferreira MC, do Nascimento Remigio AF, Moraes LB, Gemperli R.",2015,26595022,,196.0,,,,,,,,"Other type of nerve graft: masseteric, cross facial",,Masseteric nerve transfer,Cross-facial nerve transfer,,,,,
