,PMID,database,title,abstract,nerve_transfer,double_innervation_type,free_flap,other_tissue,negative_outcome,positive_outcome,measuring_tool,tool_category,botox,doi,citation,authours,year,pmid,notes,patients,time_to_reinnervation_(min),time_to_reinnervation_(max),Age,min age,max age,follow up min,follow up max,old_notes,Notes_y,nerve_transfer_type_1,nerve_transfer_type_2,nerve_transfer_type_3,other_free_flap_type_1,free_flap_type_1,free_flap_type_2,free_flap_type_3
139,30113447,Pub-med,Simultaneous Reconstruction of the Lower Lip with Gracilis Functioning Free Muscle Transplantation for Facial Reanimation: Comparison of Different Techniques,"Background: Functioning free muscle transplantation is currently the gold standard for the reconstruction of facial paralysis, focusing more on the upper lip reconstruction rather than on the lower lip. This study aimed to compare different lower lip reconstructive methods when performing functioning free muscle transplantation for facial reanimation. Methods: A retrospective review of functioning free muscle transplantation for facial reanimation from 2007 to 2015 was performed. Patients were divided into three groups: in group 1 (n = 15), a free plantaris tendon graft anchored to the gracilis muscle was passed into the lower lip to create a loop within; in group 2 (n = 12), an aponeurosis tail of the gracilis muscle was attached to the lower lip; and in group 3 (n = 18), no suspension of the lower lip was performed. All patients had at least 2 years of follow-up. Outcomes were assessed by photographs and videos, including subjective evaluation of midline deviation and horizontal tilt and objective analysis of smile dimensions and area. Results: A total of 45 patients were included. Results from the subjective evaluation demonstrate group 1 patients having the best improvement (overall score: p = 0.004 and p = 0.005, Fisher's exact test). The objective evaluation showed group 1 and 2 patients with better results compared with group 3 (horizontal component, p = 0.009; vertical component, p = 0.004; area distribution, p < 0.001, Kruskal-Wallis test). Conclusions: Both plantaris tendon graft and gracilis aponeurosis achieved better improvement in subjective and objective evaluations than those who had no reconstruction of the lower lip. In particular, the plantaris tendon graft can achieve the most lower lip excursion with overall improved symmetry. Clinical question/level of evidence: Therapeutic, III.",0,,1,2,0.0,1,1,2,0,10.1097/PRS.0000000000004849,Plast Reconstr Surg. 2018 Nov;142(5):1307-1317. doi: 10.1097/PRS.0000000000004849.,"Lin JT, Lu JC, Chang TN, Chuang DC.",2018,30113447,"Tools: Adobe Photoshop Outcome: symmetry, midline deviation plantaris tendon graft",45.0,,,,,,,,,,no nerve transfer,,,,,,
140,30325893,Pub-med,Evaluation of Donor Morbidity following Single-Stage Latissimus Dorsi Neuromuscular Transfer for Facial Reanimation,"Background: Single-stage latissimus dorsi neuromuscular transfer has been a valuable option for dynamic smile reanimation. However, there is a paucity of studies evaluating the potential donor morbidity in such cases. The present study aimed to comprehensively analyze the donor morbidity following functional latissimus dorsi muscle transfer. Methods: Patients who underwent single-stage functional latissimus dorsi muscle transfer for smile reanimation between 2002 and 2016 were reviewed. Postoperative complications and functional impairments at the donor sites were evaluated. The Quick-Disabilities of the Arm, Shoulder and Hand questionnaire was used for assessing postoperative donor-site function. Results: Sixty patients, including 12 pediatric (18 years or younger) patients, were analyzed. Mean length of a harvested thoracodorsal nerve was 14.9 cm. Fourteen patients were treated with a dual innervation technique, in which both a descending and a transverse branch of the thoracodorsal nerve were harvested. Donor complications were observed in seven cases; all of them were seromas and resolved by simple aspiration. No other complications including scoliosis and sensory and/or motor disturbances in the upper extremities were encountered. Fifty patients responded to the Quick-Disabilities of the Arm, Shoulder and Hand questionnaire at a median follow-up of 51 months. The average score was 2.64, and all but three patients scored less than 10. No variables, including patient age (pediatric versus adult) and the use of a dual-innervation technique, affected the donor morbidities, including the functional deficits. Conclusion: Single-stage latissimus dorsi neuromuscular transfer for facial reanimation might be associated with a low rate of complications and minimal functional morbidity at the donor site. Clinical question/level of evidence: Therapeutic, IV.",6,,2,1,6.0,0,9,3,0,10.1097/PRS.0000000000005168,Plast Reconstr Surg. 2019 Jan;143(1):152e-164e. doi: 10.1097/PRS.0000000000005168.,"Lee KT, Lee YJ, Kim A, Mun GH.",2019,30325893,"Tools: Quick-Disabilities of the Arm, Shoulder and Hand questionnaire thoracodorsal nerve, LD muscle transfer",66.0,,,,,,,,,,Double innervation,,,['Latissimus dorsi flap'],Latissimus dorsi flap,,
141,30325983,Pub-med,Comparison of Objective Outcomes in Dynamic Lower Facial Reanimation With Temporalis Tendon and Gracilis Free Muscle Transfer,"Importance: Facial paralysis affects patients' physical, social, and psychological function. Dynamic smile reanimation can mitigate these effects, but there are limited data to guide the surgeon in selecting the best reanimation procedure for each patient. Objective: To compare quantitative changes in oral commissure symmetry and smile excursion following temporalis tendon transfer (T3) and gracilis free muscle transfer. Design, setting, and participants: Retrospective case series of 28 adults with unilateral facial paralysis seeking dynamic lower facial reanimation at a tertiary academic medical center between July 1, 2010, and July 30, 2014. Data were analyzed from May 1, 2016, to June 30, 2016. Interventions: Minimally invasive T3 (n = 14) compared with gracilis free muscle transfer (n = 14). Main outcomes and measures: Measured symmetry of the oral commissure between the healthy and paralyzed sides in the horizontal, vertical, and angular dimension and excursion of the paralyzed commissure following reanimation compared with the healthy commissure. Results: Of the 28 patients, 19 (68%) were women; mean (SD) age was 51.7 (17) years. Commissure symmetry during smile improved significantly for the T3 patients in the vertical and angular dimensions, and the gracilis free muscle transfer patients had significant improvement in the vertical and horizontal dimensions. Commissure excursion significantly improved in both groups following surgery, with a larger improvement seen in the gracilis free muscle transfer group (11.3 mm; 95% CI, 7.0 to 15.5 mm) compared with the T3 group (4.8 mm; 95% CI, 0.2 to 9.3 mm), with a mean difference of 6.5 mm (95% CI, 0.7 to 12.4 mm; Cohen d, 0.86). Postoperative smile excursion of the paralyzed side was within 1.0 mm of the healthy side in the gracilis free muscle transfer group (95% CI, -2.1 to 4.0 mm). Conclusions and relevance: Temporalis tendon transfer and gracilis free muscle transfer both improve oral commissure symmetry and excursion in facial paralysis. The improvement in smile excursion appears to be larger in patients treated with gracilis free muscle transfer and, on average, the excursion approximates the contralateral healthy side.",6,Masseteric + CFNG,1,3,3.0,9,1,2,0,10.1001/jamaoto.2018.1964,JAMA Otolaryngol Head Neck Surg. 2018 Dec 1;144(12):1162-1168. doi: 10.1001/jamaoto.2018.1964.,"Oyer SL, Nellis J, Ishii LE, Boahene KD, Byrne PJ.",2018,30325983,"Tools: photos, FACEgram, Outcomes: Facial commissure symmetry, smile excursion",28.0,,,,,,,,,,Double innervation,,,,,,
142,30333080,Pub-med,Gracilis transplantation and temporalis transposition in longstanding facial palsy in adults: Patient-reported and aesthetic outcomes,"Background: In longstanding facial palsy, gracilis free functional muscle transfer (FFMT) is currently considered to be the gold standard in smile reanimation. An alternative to muscle free flaps is local muscle transposition, with the temporalis muscle transposition being the preferred procedure, because of its direction of pull when transposed. The present study aimed to compare outcomes of gracilis FFMT neurotised by the masseteric nerve and temporalis muscle transposition in longstanding facial palsy using patient-reported and aesthetic outcomes. Methods: A cross-sectional comparison of gracilis FFMT and temporalis muscle transpositions was performed. Pre- and postoperative excursion measures were obtained. Patients were asked to answer a satisfaction questionnaire, quality of life questionnaire (FaCE scale) and a depression and anxiety questionnaire (HADS). Laypeople were asked to rate the pre- and postoperative aesthetic appearance. Results: Of 28 eligible patients, 10 gracilis and 12 temporalis patients participated. No significant differences were found between both groups in postoperative quality of life or depression/anxiety. Layperson observers judged the aesthetic appearance to be similar. Conclusion: In the present study, gracilis FFMT did not lead to superior quality of life and aesthetic outcomes compared to temporalis muscle transpositions. The facial nerve specialist should perform the procedure he or she expects to lead to optimal results for the patient.",0,,1,1,0.0,9,3,1,0,10.1016/j.jcms.2018.09.029,J Craniomaxillofac Surg. 2018 Dec;46(12):2144-2149. doi: 10.1016/j.jcms.2018.09.029. Epub 2018 Sep 26.,"van Veen MM, Dijkstra PU, le Coultre S, Mureau MAM, Werker PMN.",2018,30333080,"Tools: satisfaction questionnaire, quality of life questionnaire (FaCE scale), depresion and anxiety questionnaire (HADS) Outcomes: aesthetic appearance, smile excursion, symmetry, Change scores (pre vs postop)",10.0,,,,,,,,,,no nerve transfer,,,,,,
143,30509736,Embase,Pre-operative masseter muscle EMG activation during smile predicts synchronicity of smile development in facial palsy patients undergoing reanimation with the masseter nerve: A prospective cohort study,"Background: Synchronicity of the oral commissure movement of a bilateral smile is a significant goal for reconstruction in facial reanimation and may only be guaranteed with use of the facial nerve as a donor nerve. Yet over the years several studies report some degree of spontaneity in certain patients when using a non-facial donor nerve, which indicates that synchronous initiation of the smile might be achievable with other donor nerves. We designed a prospective cohort study to evaluate whether pre-operative involuntary activation of the masseteric nerve during smile predicts development of a synchronous smile development when using the masseteric nerve for reanimation. Methods: In a prospective cohort study unilateral long-standing facial palsy patients scheduled for dynamic smile reanimation with a free functional muscle transplant using the masseteric nerve as a donor nerve were preoperatively evaluated via EMG for involuntary activation of the masseter muscle upon smiling, which we called coactivation. Postoperatively, six months after noting the first muscle contraction smile synchronicity was evaluated. We analyzed the synchronicity of the bilateral smile development by analyzing slow-motion video sequences of the patients that were taken while the patients were watching funny video sequences. Results were then correlated with the pre-operative EMG. Results: 30 patients were recruited for this prospective study and underwent facial reanimation surgery with a free gracilis transfer innervated by the masseteric nerve. 19 patients demonstrated involuntary coactivation of the masseter muscle upon smiling and 11 did not. Postoperatively all patients could demonstrate a voluntary smile. 94% of patients who had preoperative coactivation showed a synchronous movement of the oral commissure when smiling. In those patients, that did not show activation of the masseter muscle upon smiling 0% showed synchronicity. The preoperative coactivation of the masseter muscle is able to predict the outcome regarding synchronicity of the smile with a sensitivity of 99.7%, a specificity of 88.5% and 92.5% positive predictive value and 99.6% negative predictive value (p < 0.001 for all). Conclusions: The lack of masseter co-activation with smile predicts a lack of spontaneous involuntary smile after dynamic smile reconstruction using the masseteric nerve.",2,,1,0,0.0,9,8,3,0,10.1016/j.bjps.2018.11.011,"Journal of Plastic, Reconstructive and Aesthetic Surgery (2019) 72:3 (505-512). Date of Publication: 1 Mar 2019","Lenz Y., Kiefer J., Dietrich F., Stark G.B., Eisenhardt S.U.",2019,30509736,clinical eval and EMG (preop only),19.0,,,,,,,,,,Masseteric nerve transfer,,,,,,
144,30844532,Pub-med,Neurorrhaphy for Facial Reanimation with Interpositional Graft: Outcome in 23 Patients and the Impact of Timing on the Outcome,"Objective: Neurorrhaphy with interpositional graft is a practical technique to achieve facial reanimation when the continuity of the facial nerve is interrupted and a large gap between the proximal and distal stump exists. The aim of this study was to report long-term outcomes of neurorrhaphy for facial reanimation with interpositional graft. The roles of some variable factors in the outcome of neurorrhaphy with interpositional graft were also evaluated and compared. Methods: A retrospective case series from a single tertiary referral center comprised 23 patients with facial nerve interruptions who underwent neurorrhaphy with interpositional graft using either end-to-end anastomosis or end-to-side hypoglossal-facial technique. Preoperative data (age, sex, primary lesion, interval from paralysis to surgery, facial nerve function), intraoperative data (surgical approach, graft and type of neurorrhaphy), and postoperative data (facial nerve function) were collected and analyzed. Results: Mean follow-up time was 26.6 ¬¨¬®¬¨¬Æ¬¨¬®¬¨¬± 11.9 months. Patients who underwent neurorrhaphy for facial reanimation within 1 year after onset of facial paralysis were more likely to achieve House-Brackmann grade ‚Äö√Ñ√∂‚àö√ë‚àö‚àÇ‚Äö√†√∂¬¨¬¢¬¨¬®‚àö√º3 compared with patients who underwent neurorrhaphy >1 year after onset of facial paralysis (odds ratio = 23.85, P = 0.04). No other factors were associated with improved outcomes. Conclusions: Early neurorrhaphy with interpositional graft (‚Äö√Ñ√∂‚àö√ë‚àö‚àÇ‚Äö√†√∂¬¨¬¢¬¨¬®‚àö√º1 year) for facial reanimation resulted in better final facial nerve function outcomes compared with a delayed procedure.",3,,0,2,1.0,7,8,1,0,10.1016/j.wneu.2019.02.124,World Neurosurg. 2019 Jun;126:e688-e693. doi: 10.1016/j.wneu.2019.02.124. Epub 2019 Mar 4.,"Gao Z, Jia XH, Xu J, Yu J, Wang J, Zhao WD, Chi FL, Dai CF, Li HW, Zhong P, Chen B, Yuan YS.",2019,30844532,"Tools: HB scores, clinical evaluation Outcomes: facial nerve function, sykinesis,",23.0,,,,,,,,Multiple nerve grafts:hypoglossal,,Hypoglossal nerve transfer,,,,,,
145,30949826,Embase,Reconstruction of complex defects of the extracranial facial nerve: technique of ‚Äúthe trifurcation approach‚Äù,"Purpose: Reconstruction of complex defects of facial nerve (FN) after extensive cancer surgery requires individualized solutions. We describe the trifurcation technique as a modification of the combined approach on example of two patients with locally advanced parotid cancer. Methods: Due to perineural invasion, extensive resection of the FN from the mastoid segment to the peripheral branches was required. For reanimation of the upper face, a complex cervical plexus graft was sutured end-to-end to the mastoid segment of the FN trunk. The branches of the graft enabled reanimation of three peripheral temporal and zygomatic branches. The mandibular branch was sutured end-to-side to the hypoglossal nerve (hypoglossal‚Äìfacial nerve transfer, HFNT). Additionally, the buccal branch was independently reanimated with ansa cervicalis. Results: Facial reanimation was successful in both patients. Good resting tone and voluntary movement were achieved with a mild degree of synkinesis after 13¬†months. Patient 1 showed the Sunnybrook (SB) composite score 69 [76 (voluntary movement score) ‚àí 0 (resting symmetry score) ‚àí 7 (synkinesis score)]. In patient 2, the SB composite score was 76 (80 ‚àí 0 ‚àí 4, respectively). Conclusions: In this trifurcation approach, cervical cutaneous plexus provides a long complex nerve graft, which allows bridging the gap between proximal FN stump and several peripheral branches without great expenditure. In combination with the HFNT and ansa cervicalis transfer, this procedure enables the facial reanimation with low grade of synkinesis.",6,Hypoglossal + Ansa cervicalis + Cervical plexus,0,2,9.0,9,8,3,0,10.1007/s00405-019-05418-4,European Archives of Oto-Rhino-Laryngology (2019) 276:6 (1793-1798). Date of Publication: 1 Jun 2019,"Beutner D., Grosheva M.",2019,30949826,"sunnybrook score
neg: asymmetry, synkinesis",2.0,13.0,,,,,,,"Multiple nerve grafts:hypoglossal,ansa cervicalis",,Double innervation,,,,,,
146,31083101,Pub-med,Facial Nerve Translocation for Low Tension Neurorrhaphy to Masseteric Nerve,"Introduction: The techniques of facial reanimation are continually evolving in search of the ideal method for rehabilitating the paralyzed face. In the past, alternative cranial nerve motor nuclei have been used to power facial musculature. The trigeminal nerve is gaining popularity as a promising nerve to drive facial motion, particularly in the lower face. Objectives: This article describes a low-tension technique of using the transposed facial nerve to the trigeminal nerve (masseteric branch) for facial reanimation. Methods: Six patients over 2.5 years were treated with facial nerve translocation with division at the geniculate and direct neurorrhaphy to the motor branch of the masseter. Patients were evaluated by physical examination, measurement of oral commissure excursion using MEEI FACE-gram software, video assessment, Sunnybrook Facial Grading System, Facial Disability Index, and Facial Clinimetric Evaluation Scale (FaCE). Results: Patients demonstrated early motion within 4 months postoperatively and were placed into facial physical therapy. All demonstrated improvements in oral competence, strong oral commissure excursion with good symmetry, speech improvements, and variable results in facial tone. Synkinesis to the smile antagonists in the lower face was noted and treated with chemodenervation in three of six. No upper division synkinesis was noted. Conclusion: The motor branch of the trigeminal nerve is an effective option for facial reanimation via facial nerve translocation and end-to-end neurorrhaphy. Variable results in facial tone were noted with excellent oral commissure excursion. This procedure is safe in the reoperated mastoid.",4,,0,1,1.0,9,9,3,0,10.1097/MAO.0000000000002195,Otol Neurotol. 2019 Jun;40(5):e562-e565. doi: 10.1097/MAO.0000000000002195.,"Hetzler L, MacDowell S, Trahan J, Arriaga M, McDaniel LS.",2019,31083101,"MEEI FACEgram softwae, Sunnybrook Facial Gradig System, Facial Diability Index, FaCE Scale",6.0,,,,,,,,,,Motor nerve,Trigeminal nerve transfer,,,,,
147,31348359,Pub-med,"Using the ""Sugarcane Chewing"" Concept as the Directionality of Motor Neurotizer Selection for Facial Paralysis Reconstruction: Chang Gung Experiences","Background: Facial paralysis and postparalysis facial synkinesis both cause severe functional and aesthetic deficits. Functioning free muscle transplantation is the authors' preferred method for reconstructing both deformities. Methods: From 1985 to 2017, a total of 392 patients underwent 403 gracilis functioning free muscle transplantations for facial reanimation. Different motor neurotizers were used: cross-face nerve graft (74 percent), spinal accessory nerve (17 percent), and masseter nerve (8 percent). Smile excursion score, cortical adaptation stage, patient questionnaire, Hadlock lip excursion, and the Terzis evaluation systems were used to assess outcomes. Results: For smile excursion score, the spinal accessory and masseter nerve groups showed higher scores than the cross-face nerve graft group in the first 2 years, but no difference by 3-year follow-up. For cortical adaptation stage, nearly all cross-face nerve graft patients achieved stage IV or V spontaneity, the spinal accessory nerve group achieved at least stage III (independent) movement, but individuals in the masseter nerve group achieved only stage III or less. The cross-face nerve graft group also achieved higher scores according to the Hadlock system and the Terzis evaluation system compared with the other two groups. Conclusions: The concept of ""sugarcane chewing"" where the sweetness is the least at the tail but the most at the head can be simply applied for surgeons and patients in weighing the benefits and drawbacks during the motor neurotizer selection. Cross-face nerve graft-innervated gracilis is analogous to chewing sugarcane from tail to head; despite lower outcome measures earlier, it yields the highest scores at 3 years postoperatively. Masseter-innervated gracilis is akin to chewing sugarcane from head to tail, with greater outcome scores initially but little improvement at longer follow-up. Spinal accessory-innervated gracilis results fall in between these two groups. Clinical question/level of evidence: Therapeutic, IV.",4,,1,3,0.0,3,8,1,0,10.1097/PRS.0000000000005871,Plast Reconstr Surg. 2019 Aug;144(2):252e-263e. doi: 10.1097/PRS.0000000000005871.,"Chuang DC, Lu JC, Chang TN, Hamdi Sakarya A.",2019,31348359,"Tools: Hadlock system NO: hematoma, saliva accumulation, flap loss",392.0,,,,,,,,"Multiple nerve grafts:cross-face,masseter nerve",,Cross-facial nerve transfer,Masseteric nerve transfer,,,,,
148,31403508,Pub-med,A Modified Technique of Transposition of Temporalis Muscle in Selected Cases of Longstanding Facial Paralysis,"The authors present a modified technique of temporalis muscle transposition technique in cases of longstanding facial paralysis. Slips of the temporalis fascia were passed through the tunnels to reach the contralateral para-median plane. The procedure provides 2 point of fixation to the transferred muscle. Local flaps were used for temporal hollow obliteration and for temporalis muscle elongation.This case series included 11 patients. The modified technique was performed for all patients to reanimate the lower face while gold weight impanation in the upper eye lid was used for re-animation of the eye in 9 patients. By the end of follow up, the procedure was considered successful in 9 patients. Eight patients expressed their satisfaction and 7 patients were happy with the regained facial movement.The modified temporalis muscle transfer technique might be a valuable option in cases of longstanding facial paralysis. The lips would be camouflaged, non-stretched and would move with the whole mid-face.",0,,0,1,0.0,4,6,2,0,10.1097/SCS.0000000000005804,J Craniofac Surg. 2020 Jan/Feb;31(1):e1-e4. doi: 10.1097/SCS.0000000000005804.,"Askar SM, Mohammed NN, Elibiary HA.",2020,31403508,"PO: facial movement, pt satisfaction. Deep temporal fascial slings pedicled on the superficial temporal artery",11.0,,,,,,,,,,no nerve transfer,,,,,,
149,31447219,Pub-med,Three-dimensional assessment of restored smiling mobility after reanimation of unilateral facial palsy by triple innervation technique,"The aim of this study was to assess surgically restored facial mobility using an optical 3D instrument. Eleven patients (age range 42-76 years) with unilateral facial palsy, treated by triple innervation procedure (masseteric and partial hypoglossal reinnervation, plus double cross-face facial grafting), performed five facial animations: rest position, smiling by contracting the healthy side, clenching the teeth, and pushing the tongue against the lower incisors and Mona Lisa smiling. These were recorded by stereophotogrammetry. Sixty healthy subjects were also recorded. The 3D reconstruction of each facial expression was registered onto the rest position scan, and the root mean square (RMS) point-to-point distance between the two 3D surfaces was calculated automatically for the facial thirds. RMS values on the rehabilitated hemiface were 74.8% (upper third), 46.6% (middle third), and 54.1% (lower third) of those recorded in healthy subjects. RMS values were higher in the middle and lower thirds than in the upper third, and during smile provided by masseteric stimulus (P<0.05). The rehabilitated hemiface differed more from healthy subject values than the healthy hemiface did (P<0.05). On average, patients were more asymmetric than healthy subjects (P=0.004). The proposed method is non-invasive and non-contact, and it can quantify localized facial movements after surgical procedures.",6,Masseteric + Partial Hypoglossal Reinnervation + Double CFNG,0,0,0.0,9,1,2,0,10.1016/j.ijom.2019.07.015,Int J Oral Maxillofac Surg. 2020 Apr;49(4):536-542. doi: 10.1016/j.ijom.2019.07.015. Epub 2019 Aug 23.,"Gibelli D, Tarabbia F, Restelli S, Allevi F, Dolci C, Dell'Aversana Orabona G, Cappella A, Codari M, Sforza C, Biglioli F.",2020,31447219,"Tools: VECTRA 3D Outcome:root mean square, inter-class correlation coefficients, absolute and relative technical errors of measurement masseteric and partial hypoglossal reinnervation, plus double cross-face facial grafting",11.0,,,,,,,,"Multiple nerve grafts:cross-face,hypoglossal","masseteric and partial hypoglossal reinnervation, plus double cross-face facial grafting",Double innervation,,,,,,
